{
  "name": "shell-quality",
  "displayName": "Shell Quality",
  "version": "0.2.0",
  "description": "Makes every shell script Claude edits pass shfmt and ShellCheck. A plugin hook formats each .sh and .bash file with the shfmt and checks it with the ShellCheck you already have installed, in your project or globally, using your own .shellcheckrc and .editorconfig; asks you before Claude adds a suppression directive or changes that configuration; and keeps Claude working, up to 7 attempts, until the scripts it touched are clean. Its skill teaches Claude to install, configure, run, integrate and fix findings with both tools from the official documentation.",
  "author": {
    "name": "Nery Samuel Murillo",
    "url": "https://github.com/nerymurillohnd"
  },
  "homepage": "https://github.com/nerymurillohnd/claude-essentials/tree/main/plugins/shell-quality",
  "repository": "https://github.com/nerymurillohnd/claude-essentials",
  "license": "Apache-2.0",
  "keywords": [
    "bash",
    "shell",
    "shellcheck",
    "shfmt",
    "lint",
    "format",
    "pre-commit",
    "hooks",
    "quality-gate",
    "guardrails"
  ],
  "userConfig": {
    "enabled": {
      "type": "boolean",
      "title": "Shell hook",
      "default": true,
      "description": "On: after each edit Claude makes to a .sh or .bash file, the hook formats it with shfmt and checks it with ShellCheck, and keeps Claude working until it passes. Off: the hooks do nothing; the skill stays available."
    }
  },
  "metadata": {
    "marketplace": {
      "category": "development",
      "tags": [
        "shell",
        "bash",
        "shellcheck",
        "shfmt",
        "formatting",
        "pre-commit",
        "quality-gate",
        "guardrails"
      ]
    }
  }
}
