{
  "name": "block-no-verify",
  "displayName": "Block No Verify",
  "version": "0.1.3",
  "description": "Stops Claude from skipping your Git hooks or commit signing: only when you ask and approve a scope, its skill installs a Claude Code PreToolUse hook that denies Git commands Claude runs with --no-verify, -n, --no-gpg-sign, core.hooksPath overrides, HUSKY=0, and similar bypasses. Installing the plugin wires nothing, and it never controls your own terminal or CI.",
  "author": {
    "name": "Nery Samuel Murillo Tejada",
    "url": "https://github.com/nerymurillohnd"
  },
  "homepage": "https://github.com/nerymurillohnd/claude-essentials/tree/main/plugins/block-no-verify",
  "repository": "https://github.com/nerymurillohnd/claude-essentials",
  "license": "Apache-2.0",
  "keywords": [
    "git",
    "hooks",
    "pre-commit",
    "husky",
    "lefthook",
    "commit-signing",
    "no-verify",
    "guardrails"
  ],
  "metadata": {
    "marketplace": {
      "category": "security",
      "tags": [
        "git",
        "git-hooks",
        "commit-signing",
        "no-verify",
        "pre-commit",
        "husky",
        "lefthook",
        "guardrails"
      ]
    }
  }
}
