{
  "name": "sample-plugin",
  "displayName": "Sample Plugin",
  "version": "0.1.0",
  "description": "Fixture plugin used only by the gate tests; never listed in the catalog.",
  "author": {
    "name": "Claude Essentials maintainers"
  },
  "homepage": "https://github.com/nerymurillohnd/claude-essentials/tree/main/tests/fixtures/plugins/sample-plugin",
  "repository": "https://github.com/nerymurillohnd/claude-essentials",
  "license": "MIT",
  "keywords": ["development", "example", "getting-started"],
  "metadata": {
    "minClaudeCodeVersion": "2.1.289"
  }
}
